{
    "version": 1,
    "size": {
        "x": 32,
        "y": 32
    },
    "license": "",
    "copyright": "sprites provided by @WillyBillyGilly, licensed under CC-BY-SA 3.0",
    "states": [
        {
            "name": "base"
        },
        {
            "name": "base-spent"
        },
        {
            "name": "tip"
        }
    ]
}
