{
    "version": 1,
    "license": "",
    "copyright": "Built by the Hullrot Team for the Hullrot Project. All rights reserved. This art is proprietary. Do not modify, redistribute, relicense, or use in any way.",
    "size": {
        "x": 64,
        "y": 64
    },
    "states": [
        {
            "name": "scourer"
        }
    ]
}
