{
    "version": 1,
    "size": {
        "x": 32,
        "y": 32
    },
    "license": "",
    "copyright": "sprites provided by @WillyBillyGilly, licensed under CC-BY-SA 3.0",
    "states": [
        {
            "name": "base"
        },
        {
            "name": "icon"
        },
        {
            "name": "mag-0"
        },
        {
            "name": "mag-1"
        },
        {
            "name": "mag-2"
        },
        {
            "name": "mag-3"
        },
        {
            "name": "mag-4"
        },
        {
            "name": "mag-5"
        },
        {
            "name": "mag-6"
        },
        {
            "name": "mag-7"
        }
    ]
}
