{
  "version": 1,
  "license": "CC-BY-SA-3.0",
  "copyright": "sprites provided by @WillyBillyGilly and @miket, licensed under CC-BY-SA 3.0",
  "size": {
    "x": 32,
    "y": 32
  },
  "states": [
    {
      "name": "icon"
    },
    {
      "name": "welder_flame",
      "delays": [
        [
          0.2,
          0.1
        ]
      ]
    },
    {
      "name": "inhand-left",
      "directions": 4
    },
    {
      "name": "inhand-right",
      "directions": 4
    },
    {
      "name": "inhand-left-flame",
      "directions": 4,
      "delays": [
        [
          0.2,
          0.2,
          0.2
        ],
        [
          0.2,
          0.2,
          0.2
        ],
        [
          0.2,
          0.2,
          0.2
        ],
        [
          0.2,
          0.2,
          0.2
        ]
      ]
    },
    {
      "name": "inhand-right-flame",
      "directions": 4,
      "delays": [
        [
          0.2,
          0.2,
          0.2
        ],
        [
          0.2,
          0.2,
          0.2
        ],
        [
          0.2,
          0.2,
          0.2
        ],
        [
          0.2,
          0.2,
          0.2
        ]
      ]
    }
  ]
}
