{
    "version": 1,
    "license": "",
    "copyright": "sprites provided by @WillyBillyGilly, licensed under CC-BY-SA 3.0",
    "size": {
        "x": 32,
        "y": 32
    },
    "states": [
        {
            "name": "icon"
        },
        {
            "name": "base"
        },
        {
            "name": "bolt-open"
        },
        {
            "name": "mag-0"
        },
        {
            "name": "inhand-left",
            "directions": 4
        },
        {
            "name": "inhand-right",
            "directions": 4
        }
    ]
}
