{
    "version": 1,
    "license": "",
    "copyright": "sprites provided by @WillyBillyGilly, @_miket and @lokamatoka, licensed under CC-BY-SA 3.0",
    "size": {
        "x": 48,
        "y": 32
    },
    "states": [
        {
            "name": "icon"
        },
        {
            "name": "base"
        },
        {
            "name": "bolt-open"
        },
        {
            "name": "inhand-left",
            "directions": 4
        },
        {
            "name": "inhand-right",
            "directions": 4
        },
        {
            "name": "wielded-inhand-left",
            "directions": 4
        },
        {
            "name": "wielded-inhand-right",
            "directions": 4
        },
        {
            "name": "equipped-BACKPACK",
            "directions": 4
        },
        {
            "name": "equipped-SUITSTORAGE",
            "directions": 4
        }
    ]
}
